,name,id,office,position,cars_info,cars_family_info,all_cars_sum_uah_mln,monthly_salary,all_salary,car_years,all_estate,group,group_car,group_flat,group_years
3195,Лєднік Олег Вікторович,vulyk_29_195,Державна фіскальна служба / Державна митна служба / Державна податкова служба / Податкова інспекція / Міністерство зборів та доходів/,перший заступник начальника кременчуцької одпі гу дфс у полтавській області,Toyota Camry;ВАЗ 21213;;,Ford Kuga;,0.6,5870.0,5870.0,8.5,186.0,митники,medium,superlow,high
3199,Лівочка Людмила Іванівна,vulyk_37_100,Загальний місцевий суд,голова ворошиловського районного суду м. донецька,Toyota Rav 4;;,Lexus RX 350;;;;;,0.73,20816.0,36120.0,1.7,451.0,суди,medium,low,superlow
3205,Лікарчук Костянтин Ігорович,vulyk_4_2_11,Державна фіскальна служба / Державна митна служба / Державна податкова служба / Податкова інспекція / Міністерство зборів та доходів/,заступник голови державної фіскальної служби україни,BMW Z4;Audi A8;Kia Sportage;;,;;;;,1.23,175302.0,175302.0,0.6,848.0,митники,high,medium,superlow
3210,Ліпінський Андрій Віталійович,vulyk_13_133,Державна фіскальна служба / Державна митна служба / Державна податкова служба / Податкова інспекція / Міністерство зборів та доходів/,начальник лівобережної одпі м. дніпропетровська гу дфс у дніпропетровській області,Mitsubishi ASX;;;,Honda Pilot;;;,0.53,5712.0,5712.0,7.8,228.0,митники,medium,superlow,high
3220,Літвінов Євген Володимирович,vulyk_8_180,Вищий спецiалiзований суд України з розгляду цивiльних i кримiнальних справ,суддя вищого спеціалізованого суду україни з розгляду цивільних і кримінальних справ,Volkswagen Touareg;;,Lexus RX-270;;,1.17,23796.0,26435.0,3.7,44.0,суди,high,superlow,medium
3239,Мазур Ольга Анатоліївна,vulyk_13_128,Державна фіскальна служба / Державна митна служба / Державна податкова служба / Податкова інспекція / Міністерство зборів та доходів/,перший заступник начальника дпі у красногвардійському районі м. дніпропетровська гу дфс у дніпропетровській області,Toyota Rav 4;;;,Nissan Almera Classic;Honda Accord;;,0.67,4463.0,8401.0,6.7,65.0,митники,medium,superlow,medium
3241,Мазуренко Олександр Анатолійович,vulyk_29_186,Державна фіскальна служба / Державна митна служба / Державна податкова служба / Податкова інспекція / Міністерство зборів та доходів/,начальник дпі у м. ялта гу міндоходів у ар крим,;;;,Lexus RX400;Mercedes-Benz ML 350,0.99,649.0,649.0,127.0,24.0,митники,medium,superlow,high
3245,Мазурик Олена Федорівна,vulyk_51_21,Загальний апеляційний суд,суддя апеляційного суду міста києва,BMW X3;BMW X5;;,BMW X3;BMW X5;;;,1.86,19191.0,19191.0,8.1,583.0,суди,high,medium,high
3251,Майданік Віктор Вікторович,vulyk_43_160,Загальний апеляційний суд,суддя апеляційного суду херсонської області,Hyundai Tucson;;,Hyundai Tucson;;,0.29,20615.0,20615.0,1.2,434.0,суди,low,low,superlow
3258,Макаренко Михайло Миколайович,vulyk_16_72,Державна фіскальна служба / Державна митна служба / Державна податкова служба / Податкова інспекція / Міністерство зборів та доходів/,начальник індустріальної одпі м. харкова гу міндоходів у харківській області,Toyota Camry;;,Toyota Land Cruiser Prado;;;;;;,0.56,5788.0,11145.0,4.2,81.0,митники,medium,superlow,medium
3259,Макаренко Оксана Вікторівна,vulyk_59_76,Господарський місцевий суд,суддя господарського суду харківської області,;;,Land Rover Range Rover Evoque;Land Rover Range Rover Sport;Mitsubishi Lancer;Peugeot 107,1.66,15774.0,19659.0,7.0,325.0,суди,high,low,high
3262,Макаров Денис Валерійович,vulyk_13_199,Державна фіскальна служба / Державна митна служба / Державна податкова служба / Податкова інспекція / Міністерство зборів та доходів/,перший заступник начальника дніпродзержинської об'єднаної державної податкової інспекції головного управління дфс у дніпропетровській області,Toyota Prado GX;Mitsubishi ASX;;,Mitsubishi ASX;;;,0.79,5503.0,5605.0,11.7,54.0,митники,medium,superlow,high
3267,Макарчук Михайло Андрійович,vulyk_9_71,Вищий спеціалізований суд з розгляду цивільних і кримінальних справ,"суддя вищого спеціалізованого суду україни з розгляду цивільних і кримінальних справ, член вищої кваліфікаційної комісії суддів україни",Nissan Murano;Mitsubishi Outlander;ЗАЗ Lanos;;,ИЖ 21251;;;,0.6,28068.0,28068.0,1.8,102.0,суди,medium,superlow,superlow
3271,Маклаков Станіслав Олександрович,vulyk_19_22,Міністерство внутрішніх справ,начальник удсбез умвс у вінницькій області полковник міліції,Toyota Camry;;,Mercedes GL 450;;,0.63,5519.0,5519.0,9.5,140.0,МВС,medium,superlow,high
3274,Макойда Зеновій Миколайович,vulyk_45_9,Загальний апеляційний суд,суддя aпеляційного суду львівської області,Nissan Pathfinder;;,Nissan Pathfinder;;;;,0.46,1116.0,1116.0,34.7,382.0,суди,low,low,high
3288,Максюта Жанна Іванівна,vulyk_40_53,Загальний апеляційний суд,суддя апеляційного суду дніпропетровської області,;;,Honda CR-V;ВАЗ 21043,0.14,19514.0,19514.0,0.6,328.0,суди,low,low,superlow
3293,Малетич Михайло Михайлович,vulyk_8_101,Вищий господарський суд,суддя вищого господарського суду україни,Mercedes-Benz ML 350;;,;;,0.8,24922.0,24922.0,2.7,566.0,суди,medium,medium,medium
3311,Мальцев Дмитро Володимирович,vulyk_13_200,Державна фіскальна служба / Державна митна служба / Державна податкова служба / Податкова інспекція / Міністерство зборів та доходів/,перший заступник начальника дпі у анд районі м. дніпропетровська гу міндоходів дніпропетровської області,Mercedes E300;BMW 730;Volkswagen Touareg;,;;;,1.39,927.0,3465.0,33.5,57.0,митники,high,superlow,high
3313,Маляренко Артем Васильович,vulyk_8_144,Вищий спецiалiзований суд України з розгляду цивiльних i кримiнальних справ,суддя вищого спеціалізованого суду україни з розгляду цивільних і кримінальних справ,Toyota Land Cruiser Prado;;,;;,0.56,20590.0,27501.0,1.7,142.0,суди,medium,superlow,superlow
3322,Мамалуй Олександр Олексійович,vulyk_59_77,Господарський місцевий суд,суддя господарського суду харківської області,Mercedes E280;Mercedes ML350;,Mazda CX-7;Chevrolet Lacetti;;,0.52,23410.0,36912.0,1.2,342.0,суди,medium,low,superlow
3324,Мамонтова Олена Миколаївна,vulyk_8_102,Вищий господарський суд,суддя вищого господарського суду україни,Lexus RX 300;;,;;,0.21,20350.0,20350.0,0.9,412.0,суди,low,low,superlow
3340,Маринін Олександр Вікторович,vulyk_17_34,Загальний місцевий суд,суддя бердянського міськрайонного суду запорізької області,Volkswagen Touareg;;;,;;;;,0.53,19831.0,19831.0,2.2,0.0,суди,medium,superlow,low
3353,Мартинюк Володимир Іванович,vulyk_8_145,Вищий спецiалiзований суд України з розгляду цивiльних i кримiнальних справ,суддя вищого спеціалізованого суду україни з розгляду цивільних і кримінальних справ,Honda CR-V;Toyota Venza;,Honda CR-V;Toyota Venza;,0.66,21693.0,21693.0,2.5,663.0,суди,medium,medium,medium
3364,Мартюхіна Наталя Олександрівна,vulyk_37_32,Апеляційний господарський суд,суддя донецького апеляційного господарського суду,Volkswagen Tiguan;;,Land Rover;Fiat Doblo;;;;,0.91,17419.0,19364.0,3.9,177.0,суди,medium,superlow,medium
3378,Марчак Віталій Ярославович,vulyk_33_156,Загальний апеляційний суд,суддя судової палати з розгляду кримінальних справ апеляційного суду чернівецької області,Toyota Rav 4;;;,Toyota Rav 4;;;,0.66,21286.0,21286.0,2.6,42.0,суди,medium,superlow,medium
3383,Марченко Нінель Валеріївна,vulyk_17_70,Загальний місцевий суд,заступник голови заводського районного суду м. запоріжжя,Toyota Land Cruiser Prado;;;,;;;;,0.51,19897.0,19897.0,2.1,49.0,суди,medium,superlow,medium
3386,Марченко Олександр Степанович,vulyk_10_107,Державна фіскальна служба / Державна митна служба / Державна податкова служба / Податкова інспекція / Міністерство зборів та доходів/,перший заступник начальника львівської митниці дфс,BMW X6;;,;;;;,1.21,1439.0,1439.0,70.2,0.0,митники,high,superlow,high
3391,Марчук Наталія Олегівна,vulyk_8_181,Вищий спецiалiзований суд України з розгляду цивiльних i кримiнальних справ,суддя вищого спеціалізованого суду україни з розгляду цивільних і кримінальних справ,Nissan Tiida;;,Mitsubishi Outlander XL;ЛУАЗ;,0.53,23217.0,39999.0,1.1,193.0,суди,medium,superlow,superlow
3396,Маслов Василь Олексійович,vulyk_56_32,Загальний апеляційний суд,суддя апеляційного суду сумської області,Ford Focus;Москвич / АЗЛК 412;Fiat Doblo,;;,0.3,22960.0,26481.0,0.9,330.0,суди,low,low,superlow
3437,Мацібора Юрій Ігорович,vulyk_10_10,Державна фіскальна служба / Державна митна служба / Державна податкова служба / Податкова інспекція / Міністерство зборів та доходів/,начальник митного поста «дністер» вінницької митниці дфс,;;,Hyundai Tucson;Suzuki Splash;;;,0.27,8687.0,8687.0,2.5,318.0,митники,low,low,medium
3458,Мележик Неоніла Іванівна,vulyk_8_36,Вищий господарський суд,суддя вищого господарського суду україни,Lexus;Suzuki;,Daewoo;Таврия;,0.67,23742.0,30185.0,1.9,523.0,суди,medium,medium,superlow
3463,Мельник Ірина Миколаївна,vulyk_16_29,Загальний місцевий суд,суддя комінтернівського районного суду м. харкова,Toyota Land Cruiser Prado;;,Toyota Land Cruiser Prado;Mazda 6;Lexus;Volkswagen Caddy;ЗАЗ 110308-45;;,1.09,19355.0,25301.0,3.6,189.0,суди,high,superlow,medium
3467,Мельник Василь Ярославович,vulyk_27_184,Загальний місцевий суд,"суддя, голова березнівського районного суду рівненської області",Chery Tiggo;;,;;,0.11,19692.0,20498.0,0.5,340.0,суди,low,low,superlow
3468,Мельник Володимир Васильович,vulyk_51_72,Загальний апеляційний суд,суддя апеляційного суду м. києва,Toyota Camry;;;,;;;;,0.35,14319.0,21872.0,1.3,472.0,суди,low,low,superlow
3470,Мельник Дмитро Михайлович,vulyk_27_117,Державна фіскальна служба / Державна митна служба / Державна податкова служба / Податкова інспекція / Міністерство зборів та доходів/,перший заступник начальника дпі у м. полтава,Kia Ceed;;,Hyundai Santa FE;Volvo 340;Kia Ceed,0.63,5322.0,5322.0,9.8,172.0,митники,medium,superlow,high
3481,Мельник Сергій Васильович,vulyk_32_194,Міністерство внутрішніх справ,начальник мгб умвс україни в хмельницькій області,Lexus RX 330;;;,Lexus RX 330;;,0.46,8647.0,8647.0,4.4,375.0,МВС,low,low,medium
3482,Мельник Сергій Михайлович,vulyk_15_64,Міністерство внутрішніх справ,заступник начальника одеського му гумвс україни в одеській області,Toyota Camry;;,;;;,0.25,10324.0,12084.0,1.8,303.0,МВС,low,low,superlow
3497,Мельничук Олена Ярославівна,vulyk_45_33,Загальний апеляційний суд,суддя апеляційного суду львівської області,Toyota Camry;;,Mercedes-Benz GL 450;;;;,0.59,22350.0,22350.0,2.2,194.0,суди,medium,superlow,medium
3498,Мельнікова Лариса Володимирівна,vulyk_56_133,Апеляційний адміністративний суд,суддя харківського апеляційного адміністративного суду,Lexus GS-250;;,;;,0.55,21131.0,21131.0,2.2,87.0,суди,medium,superlow,medium
3522,Миранюк Віталій Миколайович,vulyk_10_184,Державна фіскальна служба / Державна митна служба / Державна податкова служба / Податкова інспекція / Міністерство зборів та доходів/,заступник начальника черкаської митниці дфс,;;,Subaru Tribeca;Volkswagen Passat;;;,0.16,5317.0,5317.0,2.4,438.0,митники,low,low,medium
3537,Мисько Василь Родіонович,vulyk_34_96,Міністерство внутрішніх справ,начальник уфзбо гумвс україни в харківській області,Subaru;;,Lexus RX 350;;,0.39,16970.0,16970.0,1.9,402.0,МВС,low,low,superlow
3541,Митражик Елла Михайлівна,vulyk_30_153,Загальний місцевий суд,суддя гусятинського районного суду тернопільської області,;;,ГАЗ 2410;Hyundai;,0.12,13313.0,17723.0,0.5,392.0,суди,low,low,superlow
3547,Михайлик Микола Миколайович,vulyk_26_185,Міністерство внутрішніх справ,начальник управління карного розшуку умвс україни в полтавській області,Volkswagen Touareg;;,;;;,0.61,8735.0,8735.0,5.8,109.0,МВС,medium,superlow,medium
3558,Михайлів Любов Володимирівна,vulyk_41_185,Загальний апеляційний суд,суддя апеляційного суду дніпропетровської області,Geely Emgrand 7;;;,Samsung SM5;;;;,0.12,21467.0,21467.0,0.5,314.0,суди,low,low,superlow
3578,Могил Сергій Костянтинович,vulyk_8_20,Вищий господарський суд,суддя вищого господарського суду україни,;;,Jeep Grand Cherokee;;,0.7,21917.0,21917.0,2.6,472.0,суди,medium,low,medium
3594,Моніч Богдан Сильвестрович,vulyk_58_167,Апеляційний адміністративний суд,суддя житомирського апеляційного адміністративного суду,ЗАЗ Славута;SsangYong Korando;,Chery QQ;;;,0.25,18705.0,27579.0,0.7,384.0,суди,low,low,superlow
3595,Мора Олег Миколайович,vulyk_51_198,Загальний місцевий суд,суддя обухівського районного суду київської області,Honda Pilot;;;,Audi Q5;;;;,0.8,13657.0,29734.0,2.2,460.0,суди,medium,low,medium
3597,Моргун Галина Леонідівна,vulyk_21_154,Загальний місцевий суд,голова володарського районного суду київської області,Chevrolet Aveo;;;,Mitsubishi Pajero Wagon;;;;,0.32,18875.0,26255.0,1.0,587.0,суди,low,medium,superlow
3601,Мороз Вікторія Олександрівна,vulyk_34_5,Загальний місцевий суд,заступник голови новодністровського міського суду чернівецької області,Lexus;;,BMW X1;;,0.62,14770.0,16666.0,3.1,1386.0,суди,medium,high,medium
3602,Мороз Микола Андрійович,vulyk_8_184,Вищий спецiалiзований суд України з розгляду цивiльних i кримiнальних справ,суддя вищого спеціалізованого суду україни з розгляду цивільних і кримінальних справ,Mercedes-Benz E200;Mercedes-Benz CLK 300 4matik;,;;,0.61,29117.0,29117.0,1.7,130.0,суди,medium,superlow,superlow
3617,Мостова Галина Іванівна,vulyk_8_146,Вищий спецiалiзований суд України з розгляду цивiльних i кримiнальних справ,суддя вищого спеціалізованого суду україни з розгляду цивільних і кримінальних справ,Porsche Cayenne;;,;;,0.31,21149.0,21149.0,1.2,313.0,суди,low,low,superlow
3622,Моцьор Олексій Володимирович,vulyk_42_58,Загальний місцевий суд,суддя варвинського районного суду чернігівської області,;;;,Subaru Legacy;;,0.15,13831.0,14157.0,0.9,442.0,суди,low,low,superlow
3644,Муратова Світлана Олександрівна,vulyk_52_26,Загальний місцевий суд,"суддя, заступник голови київського районного суду м. харкова",Chrysler PT Cruiser;,Chrysler PT Cruiser;Toyota Sequoia;Mercedes-Benz E 260;BMW X6 XDrive 35i,1.41,17446.0,28701.0,4.1,369.0,суди,high,low,medium
3656,Мухін Анатолій Володимирович,vulyk_56_58,Загальний місцевий суд,суддя жовтневого районного суду м. запоріжжя,Volkswagen Touareg;;,;;,0.53,21537.0,21537.0,2.1,107.0,суди,medium,superlow,medium
3679,Мінаєв Ігор Миколайович,vulyk_37_58,Загальний місцевий суд,суддя слов'янського міськрайонного суду донецької області,;;,Skoda Octavia;;;;;,0.19,17116.0,21039.0,0.7,321.0,суди,low,low,superlow
3681,Мінаєва Ольга Михайлівна,vulyk_56_134,Апеляційний адміністративний суд,суддя харківського апеляційного адміністративного суду,;;,Audi Q5;ГАЗ М 21;,0.47,18639.0,38350.0,1.0,414.0,суди,low,low,superlow
3685,Мінів Ольга Ігорівна,vulyk_33_187,Загальний місцевий суд,суддя кіцманського районного суду чернівецької області,Honda CR-V;;;,Nissan Micra;;;,0.1,13742.0,22886.0,0.4,309.0,суди,low,low,superlow
3697,Міцней Володимир Федорович,vulyk_33_132,Загальний апеляційний суд,заступник голови апеляційного суду чернівецької області,Mitsubishi Outlander;;;,Mitsubishi Outlander;;;,0.56,21385.0,26820.0,1.8,406.0,суди,medium,low,superlow
3707,Міщенко Юрій Анатолійович,vulyk_39_36,Державна фіскальна служба / Державна митна служба / Державна податкова служба / Податкова інспекція / Міністерство зборів та доходів/,заступник начальника сумської митниці дфс,Kia Mohave;;;;;;;;;;;,;;;;,0.29,5920.0,5920.0,4.1,473.0,митники,low,low,medium
3708,Міщук Ярослав Геннадійович,vulyk_31_134,Державна фіскальна служба / Державна митна служба / Державна податкова служба / Податкова інспекція / Міністерство зборів та доходів/,перший заступник начальника кременецької одпі гу дфс у тернопільській області,Volkswagen Caddy;;;,BMW 540;Mitsubishi;ВАЗ Нива 2121,0.25,5161.0,5161.0,4.0,536.0,митники,low,medium,medium
3709,Міщій Олександр Ярославович,vulyk_45_79,Загальний апеляційний суд,заступник голови апеляційного суду тернопільської області,Nissan TIIDA;Audi 80;,;;;;,0.15,21119.0,24339.0,0.5,388.0,суди,low,low,superlow
3711,Наваляний Тарас Данилович,vulyk_12_44,Загальний місцевий суд,суддя ковельського міскрайонного суду волинської області,;;;,Volkswagen Touareg;Mitsubishi Carisma;,0.54,18999.0,18999.0,2.4,241.0,суди,medium,superlow,medium
3724,Назарко Олег Миколайович,vulyk_10_133,Державна фіскальна служба / Державна митна служба / Державна податкова служба / Податкова інспекція / Міністерство зборів та доходів/,заступник начальника митного поста одеса-аеропорт одеської митниці дфс,Toyota Prado;;,Lexus RX-350;Subaru Forester;;;,0.61,7353.0,11228.0,4.6,107.0,митники,medium,superlow,medium
3740,Насіров Роман Михайлович,chesno_2297,Державна фіскальна служба / Державна митна служба / Державна податкова служба / Податкова інспекція / Міністерство зборів та доходів/,голова державної фіскальної служби,Toyota Camry;Lexus LX 570;;;,Land Rover Range Rover;;;;,1.45,396420.0,398575.0,0.3,572.0,митники,high,medium,superlow
3748,Наумова Ірина Йосипівна,vulyk_44_47,Загальний місцевий суд,суддя комунарського районного суду м. запоріжжя,Toyota Rav 4;Mazda 6;ЗАЗ-11022,;;,0.49,20122.0,25175.0,1.6,514.0,суди,low,medium,superlow
3754,Невідома Тетяна Олексіївна,vulyk_51_23,Загальний апеляційний суд,суддя апеляційного суду міста києва,Volkswagen Tiguan;;;,Toyota Fj;;;;,0.99,22232.0,49399.0,1.7,486.0,суди,medium,low,superlow
3759,Нежура Вадим Анатолійович,vulyk_9_22,Загальний апеляційний суд,суддя апеляційного суду м. києва,Volkswagen Jetta;;;,Mitsubishi Outlander;;;;,0.35,19427.0,19427.0,1.5,337.0,суди,low,low,superlow
