,name,id,office,position,cars_info,cars_family_info,all_cars_sum_uah_mln,monthly_salary,all_salary,car_years,all_estate,group,group_car,group_flat,group_years
1,Євграфова Єлизавета Павлівна,vulyk_8_129,Вищий спецiалiзований суд України з розгляду цивiльних i кримiнальних справ,суддя вищого спеціалізованого суду україни з розгляду цивільних і кримінальних справ,Toyota Land Cruiser Prado;;,BMW 735;;,0.51,22008.0,24579.0,1.7,273.0,суди,medium,superlow,superlow
3,Євдокимов Сергій Володимирович,vulyk_60_93,Міністерство внутрішніх справ,начальник управління боротьби з незаконним обігом наркотиків гумвс україни в запорізький області,;;;,BMW X5;;;,0.52,7297.0,7297.0,6.0,109.0,МВС,medium,superlow,medium
10,Євсіков Олексій Олександрович,vulyk_8_29,Вищий господарський суд,суддя вищого господарського суду україни,Volkswagen Touareg;Volkswagen Touareg;,;;,0.98,20273.0,60257.0,1.4,289.0,суди,medium,superlow,superlow
15,Єгоров Сергій Олександрович,vulyk_15_152,Міністерство внутрішніх справ,начальник відділу карного розшуку умвс україни на одеській залізниці,Toyota Corolla;Lexus RX330;Toyota Avensis,Lexus RX330;Toyota Corolla;;,0.67,5906.0,5906.0,9.4,205.0,МВС,medium,superlow,high
17,Єлфімов Олександр Васильович,vulyk_8_170,Вищий спецiалiзований суд України з розгляду цивiльних i кримiнальних справ,суддя вищого спеціалізованого суду україни з розгляду цивільних і кримінальних справ,Toyota Land Cruiser Prado 150;;,;;,0.51,22256.0,22256.0,1.9,44.0,суди,medium,superlow,superlow
20,Ємельянова Ольга Олександрівна,vulyk_59_64,Господарський місцевий суд,суддя господарського суду харківської області,Lexus RX 350;;,ВАЗ 212140 Нива;;;,0.38,15363.0,18487.0,1.7,443.0,суди,low,low,superlow
21,Ємець Анатолій Анатолійович,vulyk_56_188,Верховний суд,суддя верховного суду україни,Volkswagen Touareg;;,Kia Sportage;;,0.7,26309.0,28285.0,2.1,515.0,суди,medium,medium,medium
28,Єрмаков Юрій В'ячеславович,vulyk_42_35,Загальний апеляційний суд,суддя апеляційного суду луганської області,Daewoo Lanos;;;,;;,0.05,17378.0,17378.0,0.2,486.0,суди,superlow,low,superlow
36,Єфремов Сергій Миколайович,vulyk_13_13,Міністерство внутрішніх справ,заступник начальника широківського районного управління гумвс україни – начальник мгб,Honda Accord;SsangYong Korando;ГАЗ 3302 Газель;,Honda Accord;;;,0.69,6556.0,8563.0,6.8,319.0,МВС,medium,low,medium
37,Єфтемій Станіслав Миколайович,vulyk_33_169,Загальний місцевий суд,голова герцаївського районного суду чернівецької області,Mercedes-Benz E 220;;;,Peugeot Partner;Mercedes-Benz E 220;;,0.55,18544.0,22415.0,2.0,285.0,суди,medium,superlow,medium
44,Єфімова Ольга Іванівна,vulyk_51_60,Загальний апеляційний суд,суддя апеляційного суду міста києва,Toyota Rav 4;;;,;;;;,0.2,22941.0,22941.0,0.7,365.0,суди,low,low,superlow
48,Іваненко Сергій Анатолійович,vulyk_26_81,Адміністративний місцевий суд,суддя полтавського окружного адміністративного суду,BMW 523i;Daihatsu Terios;,BMW 523i;;;,0.69,0.0,533.0,107.2,239.0,суди,medium,superlow,high
50,Іваненко Юлія Геннадіївна,vulyk_8_134,Вищий спецiалiзований суд України з розгляду цивiльних i кримiнальних справ,суддя вищого спеціалізованого суду україни з розгляду цивільних і кримінальних справ,BMW 4281;;,;;,0.54,22052.0,22052.0,2.0,138.0,суди,medium,superlow,medium
56,Іванов Іван Іванович,vulyk_19_6,Державна фіскальна служба / Державна митна служба / Державна податкова служба / Податкова інспекція / Міністерство зборів та доходів/,заступник начальника київської міської митниці,;;,Lexus RX 350;;,0.49,2244.0,2244.0,18.3,477.0,митники,low,low,high
59,Іванов Дмитро Іванович,vulyk_14_97,Державна фіскальна служба / Державна митна служба / Державна податкова служба / Податкова інспекція / Міністерство зборів та доходів/,заступник начальника гу дфс в одеській області,Mercedes-Benz GL 550;;;,Lexus LX 470;Mercedes-Benz S 550;;,1.1,3466.0,5286.0,17.3,420.0,митники,high,low,high
61,Іванов Сергій Володимирович,vulyk_10_136,Державна фіскальна служба / Державна митна служба / Державна податкова служба / Податкова інспекція / Міністерство зборів та доходів/,начальник митного поста одеса-порт одеської митниці дфс,Volkswagen Multivan;;,Hyundai Tiburon;;;;,0.57,6030.0,11906.0,4.0,703.0,митники,medium,medium,medium
62,Іванов Юрій Анатолійович,vulyk_14_122,Державна фіскальна служба / Державна митна служба / Державна податкова служба / Податкова інспекція / Міністерство зборів та доходів/,Начальник ДПІ у Комінтернівськом районі ГУ ДФС в Одеській області,Toyota Camry;Toyota Sienna;;,Toyota Camry;Toyota Sienna;;,0.71,5428.0,5428.0,10.9,134.0,митники,medium,superlow,high
74,Іванько Віктор Михайлович,vulyk_35_100,Міністерство внутрішніх справ,заступник начальника умвс - начальник мгб,Subaru Outback;;,;;;;,0.15,10666.0,10666.0,1.2,340.0,МВС,low,low,superlow
97,Ігнатенко Сергій Петрович,vulyk_29_169,Державна фіскальна служба / Державна митна служба / Державна податкова служба / Податкова інспекція / Міністерство зборів та доходів/,перший заступник начальника дпі у іршавському районі гу міндоходів у закарпатській області,Audi A6;Kia Ceed;;,;,0.2,4173.0,6519.0,2.6,642.0,митники,low,medium,medium
101,Ізмайлова Галина Нуріївна,vulyk_55_24,Загальний апеляційний суд,суддя апеляційного суду харківської області,;,Toyota Rav 4;;,0.18,22753.0,22753.0,0.7,390.0,суди,low,low,superlow
167,Алєксєєва Наталія Юнівна,vulyk_26_64,Адміністративний місцевий суд,суддя полтавського окружного адміністративного суду,ВАЗ 21093;Mitsubishi ASX;,Ford Kuga;Toyota Highlander;;,0.99,14608.0,160025.0,0.5,532.0,суди,medium,medium,superlow
173,Амелін Вячеслав Іванович,vulyk_8_120,Вищий спецiалiзований суд України з розгляду цивiльних i кримiнальних справ,суддя вищого спеціалізованого суду україни з розгляду цивільних і кримінальних справ,Mitsubishi Outlander XL;Hyundai Santa FE;,;;,0.56,22303.0,22303.0,2.1,179.0,суди,medium,superlow,medium
175,Андрейків Андрій Іванович,vulyk_10_18,Державна фіскальна служба / Державна митна служба / Державна податкова служба / Податкова інспекція / Міністерство зборів та доходів/,перший заступник начальника волинської митниці дфс,;;,Toyota Camry;;;;,0.17,52923.0,55617.0,0.3,370.0,митники,low,low,superlow
183,Андрухів Василь Михайлович,vulyk_13_106,Державна фіскальна служба / Державна митна служба / Державна податкова служба / Податкова інспекція / Міністерство зборів та доходів/,начальник головного управління державної фіскальної служби у дніпропетровській області,;;;,Lexus RX 350;;;,0.31,11814.0,11814.0,2.2,695.0,митники,low,medium,medium
189,Андрющенко Сергій Михайлович,vulyk_37_152,Державна фіскальна служба / Державна митна служба / Державна податкова служба / Податкова інспекція / Міністерство зборів та доходів/,заступник начальника артемівської одпі гу міндоходів у донецькій області,Toyota Camry;;,;;;;;,0.19,6201.0,6201.0,2.5,308.0,митники,low,low,medium
205,Антоненко Наталія Олександрівна,vulyk_45_198,Загальний апеляційний суд,суддя апеляційного суду м. києва,Suzuki SX4;;,;;;;,0.11,20603.0,20603.0,0.4,435.0,суди,low,low,superlow
241,Атаманчук Олексій Петрович,vulyk_29_39,Міністерство внутрішніх справ,заступник начальника - начальник мгб кам'янець-подільського рв умвс україни в хмельницькій обл..,Opel Vectra B;ВАЗ 2101;;,;,0.64,5766.0,5766.0,9.2,150.0,МВС,medium,superlow,high
243,Афонов Роман Петрович,vulyk_13_107,Державна фіскальна служба / Державна митна служба / Державна податкова служба / Податкова інспекція / Міністерство зборів та доходів/,заступник начальника головного управління дфс у запорізький області,Skoda Superb;;;,Nissan X-Trail;;;,0.54,6709.0,6709.0,6.8,197.0,митники,medium,superlow,medium
244,Ахіджанян Жанна Суренівна,vulyk_26_191,Міністерство внутрішніх справ,начальник кримінальної міліції у справах дітей умвс україни в полтавській області,Chevrolet Aveo;;,Chevrolet Aveo;;;,0.2,8851.0,8851.0,1.9,547.0,МВС,low,medium,superlow
258,Бабій Сергій Олександрович,vulyk_55_179,Загальний місцевий суд,суддя павлоградського міськрайонного суду дніпропетровської області,Mitsubishi Lancer;Toyota Rav 4,Toyota Yaris;;,0.55,14188.0,14188.0,3.3,230.0,суди,medium,superlow,medium
291,Балась Тетяна Павлівна,vulyk_54_139,Адміністративний місцевий суд,Суддя Окружного адміністративного суду міста Києва,Honda CR-V;;;,Toyota Camry;Mitsubishi Outlander;;,0.3,2517.0,8190.0,3.0,337.0,суди,low,low,medium
305,Баранов Микола Миколайович,vulyk_57_55,Господарський місцевий суд,голова господарського суду вінницької області,;;;,Subaru Forester;;;,0.17,22419.0,22579.0,0.6,378.0,суди,low,low,superlow
315,Барбара Валентин Петрович,vulyk_56_152,Верховний суд,заступник голови верховного суду україни - секретар судової палати у господарських справах,Mercedes-Benz A 150;;,Mercedes-Benz GL 350;;,1.12,29226.0,29226.0,3.2,325.0,суди,high,low,medium
321,Барицька Тетяна Луківна,vulyk_8_22,Вищий господарський суд,суддя вищого господарського суду україни,;;,BMW X5;;,0.61,25246.0,25246.0,2.0,85.0,суди,medium,superlow,medium
324,Бартащук Любов Петрівна,vulyk_42_163,Загальний місцевий суд,суддя дніпровського районного суду міста києва,BMW X5;;;,;;,0.61,17811.0,17811.0,2.8,535.0,суди,medium,medium,medium
340,Бацуца Тетяна Миколаївна,vulyk_32_182,Загальний місцевий суд,голова хмельницького міськрайонного суду хмельницької області,;;;,Volkswagen Multivan;;,0.24,23019.0,59074.0,0.3,314.0,суди,low,low,superlow
342,Башинський Станіслав Францович,vulyk_54_175,Загальний місцевий суд,голова житомирського районного суду житомирської області,Nissan Qashqai;;;,Ford Focus;Ford Kuga;;,0.51,22807.0,22807.0,1.9,200.0,суди,medium,superlow,superlow
353,Бездрабко Олег Іванович,vulyk_43_126,Адміністративний місцевий суд,суддя херсонського окружного адміністративного суду,Toyota Avensis;Toyota Camry;,;;,0.5,18925.0,18925.0,2.2,307.0,суди,medium,low,medium
380,Бенедик Анна Петрівна,vulyk_56_114,Апеляційний адміністративний суд,заступник голови харківського апеляційного адміністративного суду,;;,Volkswagen Touareg;;,0.61,22019.0,46873.0,1.1,99.0,суди,medium,superlow,superlow
381,Бенедисюк Ігор Михайлович,vulyk_8_82,Вищий господарський суд,суддя вищого господарського суду україни,Volkswagen Touareg;;,Toyota Rav 4;;,0.59,25948.0,28261.0,1.7,97.0,суди,medium,superlow,superlow
384,Бердан Наталія Володимирівна,vulyk_21_100,Загальний місцевий суд,голова калуського міськрайонного суду івано-франківської області,Daihatsu;;;,ВАЗ 2121;ВАЗ 21063;ваз 2121;Mercedes-Benz;SsangYong Rexton,0.2,19908.0,19908.0,0.8,840.0,суди,low,medium,superlow
387,Бережний Сергій Дмитрович,vulyk_32_131,Загальний апеляційний суд,суддя апеляційного суду хмельницької області,ЗАЗ Sens;;;,;;,0.05,0.0,0.0,inf,436.0,суди,superlow,low,high
396,Березнер Володимир Анатолійович,vulyk_11_85,Державна фіскальна служба / Державна митна служба / Державна податкова служба / Податкова інспекція / Міністерство зборів та доходів/,перший заступник начальника гайсинської одпі гу дфс у вінницькій області,УАЗ 469Б;Volkswagen T4;Volkswagen T5,Volkswagen Polo;;;,0.38,5900.0,10524.0,3.0,919.0,митники,low,medium,medium
417,Бех Микола Олексійович,vulyk_8_164,Вищий спецiалiзований суд України з розгляду цивiльних i кримiнальних справ,суддя вищого спеціалізованого суду україни з розгляду цивільних і кримінальних справ,Mazda CX-5;;,;;,0.34,21738.0,21738.0,1.3,553.0,суди,low,medium,superlow
418,Бех Олег Володимирович,vulyk_25_19,Міністерство внутрішніх справ,в. о. начальника умвс україни в полтавській області,;;;,BMW X5;Mini Cooper;;,0.52,8957.0,8957.0,4.9,292.0,МВС,medium,superlow,medium
420,Бець Юрій Григорович,vulyk_27_109,Міністерство внутрішніх справ,начальник лубенського мв умвс україни в полтавській області,;ІЖ-2715;,BMW X5;ІЖ-2715;,0.61,6633.0,34187.0,1.5,58.0,МВС,medium,superlow,superlow
422,Бешлієва Тетяна Анатоліївна,vulyk_15_99,Загальний місцевий суд,суддя ренійського районного суду одеської області,ВАЗ 2103;;,Chery Tiggo;;;,0.08,21082.0,22887.0,0.3,329.0,суди,superlow,low,superlow
423,Бешта Григорій Борисович,vulyk_59_145,Загальний апеляційний суд,суддя апеляційного суду волинської області,Mazda 6;;,ВАЗ Нива;;;,0.24,21784.0,26858.0,0.7,556.0,суди,low,medium,superlow
433,Бліщ Оксана Богданівна,vulyk_20_139,Загальний місцевий суд,заступник голови рахівського районного суду закарпатської області,;;;,Toyota Land Cruiser Prado;;;,0.24,18699.0,18699.0,1.1,526.0,суди,low,medium,superlow
438,Бобкова Ніна Володимирівна,vulyk_21_184,Загальний місцевий суд,заступник голови білоцерківського міськрайонного суду київської області,;;;,Toyota Camry;;;;,0.25,19179.0,27147.0,0.8,308.0,суди,low,low,superlow
439,Бобров Юрій Олександрович,vulyk_44_163,Адміністративний місцевий суд,суддя івано-франківського окружного адміністративного суду,Mercedes-Benz E-Class;;,Opel Corsa;;,0.39,20085.0,21152.0,1.6,557.0,суди,low,medium,superlow
444,Богаш Олександр Яношович,vulyk_10_71,Державна фіскальна служба / Державна митна служба / Державна податкова служба / Податкова інспекція / Міністерство зборів та доходів/,головний державний інспектор митного посту виноградів чопської митниці міндоходів,Volkswagen Tiguan;;,Volkswagen Passat;;;;,0.25,3739.0,3739.0,5.6,307.0,митники,low,low,medium
449,Боговський Дмитро Євгенович,vulyk_16_24,Загальний місцевий суд,суддя комінтернівського районного суду м. харкова,Mitsubishi Outlander;;,Mitsubishi Colt;Ford Kuga;;;;;,0.46,17350.0,17350.0,2.2,363.0,суди,low,low,medium
464,Боднарюк Олег Васильович,vulyk_51_151,Адміністративний місцевий суд,суддя (голова) чернівецького окружного адміністративного суду,BMW X6;;;,Honda Coupe;;;;,0.88,18292.0,18292.0,4.0,0.0,суди,medium,superlow,low
466,Божко Ігор Миколайович,vulyk_35_7,Державна фіскальна служба / Державна митна служба / Державна податкова служба / Податкова інспекція / Міністерство зборів та доходів/,заступник начальника-начальник чутівського відділення карлівської одпі гу міндоходів в полтавській області,Honda CR-V;;,Toyota Rav 4;;;;,0.3,5914.0,12495.0,2.0,416.0,митники,low,low,medium
484,Бойко Сергій Сергійович,vulyk_26_65,Адміністративний місцевий суд,суддя полтавського окружного адміністративного суду,Skoda Superb;;,Honda CR-V;Skoda Superb;;,0.6,16845.0,16845.0,3.0,471.0,суди,medium,low,medium
502,Болобан Валентин Георгійович,vulyk_37_127,Загальний місцевий суд,суддя ленінського районного суду м. донецька,;;,Land Rover Range Rover Sport;;;;;,0.53,10254.0,10254.0,4.3,81.0,суди,medium,superlow,medium
517,Бондар Сергій Володимирович,vulyk_8_83,Вищий господарський суд,суддя вищого господарського суду україни,;;,Renault Koleos;Renault Laguna;,0.31,22855.0,24411.0,1.1,871.0,суди,low,medium,superlow
518,Бондар Сергій Миколайович,vulyk_10_141,Державна фіскальна служба / Державна митна служба / Державна податкова служба / Податкова інспекція / Міністерство зборів та доходів/,начальник відділу митного оформлення №2 митного поста григорівка південної митниці міндоходів,Ford Fusion;Mitsubishi Pajero Sport;,Ford Fusion;;;;,0.52,5772.0,5772.0,7.5,204.0,митники,medium,superlow,high
519,Бондар Яна Миколаївна,vulyk_41_180,Загальний апеляційний суд,суддя апеляційного суду дніпропетровської області,;;;,Ford Fiesta;;;;,0.08,18955.0,18955.0,0.3,424.0,суди,superlow,low,superlow
528,Бондаренко Надія Володимирівна,vulyk_27_159,Загальний апеляційний суд,суддя апеляційного суду рівненської області,Renault Laguna;;,;;,0.14,21329.0,21329.0,0.5,523.0,суди,low,medium,superlow
542,Борденюк Євгенія Миколаївна,vulyk_8_84,Вищий господарський суд,суддя вищого господарського суду україни,Honda HR-V;;,;;,0.12,21127.0,37518.0,0.3,336.0,суди,low,low,superlow
543,Борейко Олена Миколаївна,vulyk_37_66,Загальний місцевий суд,суддя кіровського районного суду м. донецька,Lexus RX 350;;,;;;;;,0.31,6446.0,6446.0,4.0,360.0,суди,low,low,medium
545,Борець Олександр Миколайович,vulyk_29_8,Міністерство внутрішніх справ,"начальник уіаз умвс в хмельницькій області 5 категорія, 9 ранг",ВАЗ 21113;Skoda Octavia;Nissan Qashqai+2;,;,0.38,9263.0,9263.0,3.4,491.0,МВС,low,low,medium
552,Бориславський Юрій Любомирович,vulyk_18_32,Загальний місцевий суд,голова залізничного районного суду м. львова,Lexus IS 300;;,Audi Q7;;,0.92,17153.0,24446.0,3.1,261.0,суди,medium,superlow,medium
555,Борисова Олена Василівна,vulyk_51_3,Загальний апеляційний суд,суддя апеляційного суду міста києва,;;;,Mercedes-Benz A 180;;;;,0.12,19999.0,21558.0,0.4,317.0,суди,low,low,superlow
566,Бородавко Ігор Петрович,vulyk_28_169,Державна фіскальна служба / Державна митна служба / Державна податкова служба / Податкова інспекція / Міністерство зборів та доходів/,перший заступник начальника гу дфс у рівненській області,Acura MDX;Infiniti FX 37S;;;;,Mazda 3;;;,0.83,6755.0,22255.0,3.1,0.0,митники,medium,superlow,low
568,Бородовський Станіслав Олександрович,vulyk_44_89,Загальний місцевий суд,суддя івано-франківського міського суду івано-франківської області,;;,Toyota Auris;;,0.12,18858.0,18858.0,0.5,887.0,суди,low,medium,superlow
572,Бородіна Наталія Михайлівна,vulyk_52_28,Загальний місцевий суд,суддя київського районного суду м. харкова,Lexus RX 350;,Acura RL;;;,0.65,16924.0,18184.0,3.0,139.0,суди,medium,superlow,medium
598,Братасюк Віктор Миколайович,vulyk_31_3,Загальний місцевий суд,суддя тернопільського міськрайонного суду тернопільської області,Renault Duster;;;,;;,0.16,17264.0,21794.0,0.6,306.0,суди,low,low,superlow
